{"excluded_member_count":0,"excluded_members":[],"file_class":"[2] generated import manifest","import_policy":{"archive_validation":"not_applicable_embedded_proxy","excluded_directories":[".pytest_cache",".ruff_cache",".venv","__pycache__","build","legacy","out","runs"],"excluded_exact":["spec/normative/T_RECAP_Phase2_Integrated_RevJ_RevG.pdf"],"excluded_suffixes":[".pyc",".pyo"],"generated_manifest_paths":["artifacts/manifests/reference_import_manifest.json","sw/reference_model/import_manifest.json"],"manifest_serialization":"canonical-json-sort-keys-compact-ascii-lf-v1","path_policy":"portable-nfc-casefold-collision-free-v1","payload_policy":"verbatim_bytes_no_newline_or_json_normalization","policy_version":"trecap_phase2_reference_import_policy_v1","resource_caps":{"max_compression_ratio":"1000","max_entries":20000,"max_file_bytes":134217728,"max_total_bytes":1073741824}},"imported_reference_file_count":220,"imported_reference_files":[{"archive_member":null,"archive_member_raw":null,"class":"[0]","crc32":null,"origin":"embedded_proxy","path":"sw/reference_model/.clang-format","sha256":"f447030f0cc9a815df9013fdce540a94ed86ad93018e0c8d81b9ef25e1ce5c04","size_bytes":830},{"archive_member":null,"archive_member_raw":null,"class":"[0]","crc32":null,"origin":"embedded_proxy","path":"sw/reference_model/.editorconfig","sha256":"eea8eadbfdefd0d5c7088c44480a0c4918d9ddba3e527aed9a31fe51d5980801","size_bytes":809},{"archive_member":null,"archive_member_raw":null,"class":"[0]","crc32":null,"origin":"embedded_proxy","path":"sw/reference_model/.gitignore","sha256":"bf440a3046113a7bf7ca2a9d1d4616615eee4817e230f62d273e049bb536045f","size_bytes":805},{"archive_member":null,"archive_member_raw":null,"class":"[0]","crc32":null,"origin":"embedded_proxy","path":"sw/reference_model/.gitkeep","sha256":"e3b0c44298fc1c149afbf4c8996fb92427ae41e4649b934ca495991b7852b855","size_bytes":0},{"archive_member":null,"archive_member_raw":null,"class":"[0]","crc32":null,"origin":"embedded_proxy","path":"sw/reference_model/.pre-commit-config.yaml","sha256":"8a2d3a66dce8845ad9de1cca7e558ef587936acd1356fb3755dbd9acffca28dc","size_bytes":1354},{"archive_member":null,"archive_member_raw":null,"class":"[0]","crc32":null,"origin":"embedded_proxy","path":"sw/reference_model/CHANGELOG.md","sha256":"bffd963d710ce32a22c8c3676ffe9555b05a8df2379a33e807e4e03c5849c483","size_bytes":15799},{"archive_member":null,"archive_member_raw":null,"class":"[0]","crc32":null,"origin":"embedded_proxy","path":"sw/reference_model/CMakeLists.txt","sha256":"8fb399cbb9db25b6690832208dd1482a80902a086e68c99a25c3afaca75d08c1","size_bytes":4891},{"archive_member":null,"archive_member_raw":null,"class":"[0]","crc32":null,"origin":"embedded_proxy","path":"sw/reference_model/LICENSE","sha256":"7fb1b0dbbe4216ad401f8c5ac684332421a6914220dcdeedd10ee73680b2641a","size_bytes":1068},{"archive_member":null,"archive_member_raw":null,"class":"[0]","crc32":null,"origin":"embedded_proxy","path":"sw/reference_model/Makefile","sha256":"ca67d2879e10188043cf3bd65a5a049fa9cbde02e3430a4460521d3a430396be","size_bytes":21596},{"archive_member":null,"archive_member_raw":null,"class":"[0]","crc32":null,"origin":"embedded_proxy","path":"sw/reference_model/README.md","sha256":"447d6c5a5f9eed30aa3493ea855b86e25c7f0f2092cc47c06e97d7741374bd8c","size_bytes":5233},{"archive_member":null,"archive_member_raw":null,"class":"[0]","crc32":null,"origin":"embedded_proxy","path":"sw/reference_model/artifacts/coefficients/coeff_manifest.json","sha256":"aecaf4b858532dd0c42c5d14a95970fc2bdd8a3ec26555b568566c122ed312b9","size_bytes":3277},{"archive_member":null,"archive_member_raw":null,"class":"[0]","crc32":null,"origin":"embedded_proxy","path":"sw/reference_model/artifacts/coefficients/twiddle_im.memh","sha256":"d8b9c42a442e0dcaace24ec76ae28b41c29d7ad4df6e43aed1da0c1df818d1a0","size_bytes":1536},{"archive_member":null,"archive_member_raw":null,"class":"[0]","crc32":null,"origin":"embedded_proxy","path":"sw/reference_model/artifacts/coefficients/twiddle_inv_im.memh","sha256":"2ffc1ad332cb48307073a57c8dc5367c95a33210e1f4216f1b96091695f12d20","size_bytes":1536},{"archive_member":null,"archive_member_raw":null,"class":"[0]","crc32":null,"origin":"embedded_proxy","path":"sw/reference_model/artifacts/coefficients/twiddle_inv_re.memh","sha256":"84094f5e7e6bbdde3e4f458e1e5386af2d3c440f6154bcd8fbd415e521377944","size_bytes":1536},{"archive_member":null,"archive_member_raw":null,"class":"[0]","crc32":null,"origin":"embedded_proxy","path":"sw/reference_model/artifacts/coefficients/twiddle_re.memh","sha256":"84094f5e7e6bbdde3e4f458e1e5386af2d3c440f6154bcd8fbd415e521377944","size_bytes":1536},{"archive_member":null,"archive_member_raw":null,"class":"[0]","crc32":null,"origin":"embedded_proxy","path":"sw/reference_model/artifacts/coefficients/window_qw.memh","sha256":"05bcfd74bea5fe075b56a5b83c9db53ea73c4b0f6d6f45348eda0a14cf41c4ed","size_bytes":1280},{"archive_member":null,"archive_member_raw":null,"class":"[0]","crc32":null,"origin":"embedded_proxy","path":"sw/reference_model/artifacts/golden/impulse_Ns1024_thr0/frame_stats.csv","sha256":"ec1008be4adf7ba62dd77b2b4ded760ca06b5607d4b9b483a76dec58eb5ce45b","size_bytes":336},{"archive_member":null,"archive_member_raw":null,"class":"[0]","crc32":null,"origin":"embedded_proxy","path":"sw/reference_model/artifacts/golden/impulse_Ns1024_thr0/metrics.json","sha256":"8d48d182da205f5e189bdcb87e4197aaa4989501b9ddc2f647ff1df45f8f0036","size_bytes":1945},{"archive_member":null,"archive_member_raw":null,"class":"[0]","crc32":null,"origin":"embedded_proxy","path":"sw/reference_model/artifacts/golden/impulse_Ns1024_thr0/y_out.memh","sha256":"607bbb9f04d53e20d121aa1b35e140c73ed9eb00260ed22cb38981c4c3eef5d3","size_bytes":6144},{"archive_member":null,"archive_member_raw":null,"class":"[0]","crc32":null,"origin":"embedded_proxy","path":"sw/reference_model/artifacts/golden/near_threshold_multitone_Ns1024_thr64/bin_stats.csv","sha256":"b78691a1aa9dda2eae098dd75a7b673461dd385e7689694c0e53cd3d7e2e7822","size_bytes":34306},{"archive_member":null,"archive_member_raw":null,"class":"[0]","crc32":null,"origin":"embedded_proxy","path":"sw/reference_model/artifacts/golden/near_threshold_multitone_Ns1024_thr64/frame_stats.csv","sha256":"b4c185906337a44f5f040fb9e20ea95b956e3fce49d1c4920d954557a9e013cd","size_bytes":526},{"archive_member":null,"archive_member_raw":null,"class":"[0]","crc32":null,"origin":"embedded_proxy","path":"sw/reference_model/artifacts/golden/near_threshold_multitone_Ns1024_thr64/metrics.json","sha256":"164999f8bf2d56032e729cf4a53be8f8fc828aee4dbe55f51b9eeb6418193c0e","size_bytes":1972},{"archive_member":null,"archive_member_raw":null,"class":"[0]","crc32":null,"origin":"embedded_proxy","path":"sw/reference_model/artifacts/golden/near_threshold_multitone_Ns1024_thr64/y_out.memh","sha256":"718212b1cbb8fca5a60206b6a9d5b39363ae0cee8945ca792b670c035fd34117","size_bytes":6144},{"archive_member":null,"archive_member_raw":null,"class":"[0]","crc32":null,"origin":"embedded_proxy","path":"sw/reference_model/artifacts/golden/zero_Ns4096_thr0/frame_stats.csv","sha256":"b7dc0625f008147432bee9e0d99d10bd37a377e6ac500adf620d8bd4f0c4016a","size_bytes":747},{"archive_member":null,"archive_member_raw":null,"class":"[0]","crc32":null,"origin":"embedded_proxy","path":"sw/reference_model/artifacts/golden/zero_Ns4096_thr0/metrics.json","sha256":"f64c91c23bcbd2bf0883e8e036dd448dadac961c743e5bab5c92ccbe4988674b","size_bytes":1919},{"archive_member":null,"archive_member_raw":null,"class":"[0]","crc32":null,"origin":"embedded_proxy","path":"sw/reference_model/artifacts/golden/zero_Ns4096_thr0/y_out.memh","sha256":"ac450f2a1f94c04e0b50a3641dc7bfffced0f4aa58bed510148e87c11846d7cf","size_bytes":18432},{"archive_member":null,"archive_member_raw":null,"class":"[0]","crc32":null,"origin":"embedded_proxy","path":"sw/reference_model/artifacts/manifests/artifact_index.json","sha256":"067ce7c8291f292702d24f4b64f7060104eb3ea69faf3f4136fb269df45b2f52","size_bytes":13112},{"archive_member":null,"archive_member_raw":null,"class":"[0]","crc32":null,"origin":"embedded_proxy","path":"sw/reference_model/artifacts/manifests/core_config_snapshot.json","sha256":"bcecf65648099883ae02def17de56ab4140a611434bf93de314c542d9b14438a","size_bytes":1661},{"archive_member":null,"archive_member_raw":null,"class":"[0]","crc32":null,"origin":"embedded_proxy","path":"sw/reference_model/artifacts/manifests/frozen_release_manifest.json","sha256":"a0dfc6f98923d1f1e57325f0538496a57f95d710daad07252a7e30aa6961cb2e","size_bytes":14960},{"archive_member":null,"archive_member_raw":null,"class":"[0]","crc32":null,"origin":"embedded_proxy","path":"sw/reference_model/artifacts/manifests/quality_bounds.json","sha256":"437d43b8bf1a23992b64725cdb87e24d3b55d5edc147d8c8b4c3782235b3c41c","size_bytes":1833},{"archive_member":null,"archive_member_raw":null,"class":"[0]","crc32":null,"origin":"embedded_proxy","path":"sw/reference_model/artifacts/test_vectors/impulse_Ns1024_thr0/config.json","sha256":"59a3675e0a7482db9ed57611d07a561562f736e1c8693037da10721a3e263722","size_bytes":1753},{"archive_member":null,"archive_member_raw":null,"class":"[0]","crc32":null,"origin":"embedded_proxy","path":"sw/reference_model/artifacts/test_vectors/impulse_Ns1024_thr0/x_in.memh","sha256":"ba664127051e78535aa77e70d3747e1cfdbb658e3479de6b23740bf09d65b0b1","size_bytes":4096},{"archive_member":null,"archive_member_raw":null,"class":"[0]","crc32":null,"origin":"embedded_proxy","path":"sw/reference_model/artifacts/test_vectors/near_threshold_multitone_Ns1024_thr64/config.json","sha256":"8008eab8fae9fa3e40feee136581fab02271b365afe0ec1b4eeb13a407408093","size_bytes":1807},{"archive_member":null,"archive_member_raw":null,"class":"[0]","crc32":null,"origin":"embedded_proxy","path":"sw/reference_model/artifacts/test_vectors/near_threshold_multitone_Ns1024_thr64/x_in.memh","sha256":"36912af7d556f633a348f0bc294555dd16d1494f540ae542d840071e651b3e9b","size_bytes":4096},{"archive_member":null,"archive_mem